ID,GPA_unweighted,SAT_total,Income_level,Ethnicity,ExtraCurriculars,Job_years,CS ,Sports_years,Internship_flag,Leadership_flag,First_gen,Legacy,Gender,State,Major,EC_score,Award_flag,Column 1,Column 2,Column 3
722,3.9,1540,3,South Asian,"volunteer at pediatrics clinic, independent researcher at t20 med school, founder and pres of medical club, cofounded education based nonprofit, copres of another medical club, wrote a blog about ASD and special needs community, speaker of the house school's legislative council, summer internship at fortune 500, piano, VP of south asian cultural club",0,1,0,1,1,0,0,Male,,Biomedical Engineering,5,0,,,
723,3.4,1430,3,White,"300+ volunteers hrs, asst manager at job, cohead of scifi club, unit production manager at film company, play 3 instruments, babysitting, dance, NSLC, japanese club, art club",4,1,2,0,1,0,0,Female,California,Biology,4,0,,,
724,4,1580,3,Asian (Indian),"political activism leader in org, NHS, media club, local library volunteer, independent research, scienceoly, data analytics internship, engineering internship",0,1,0,1,1,0,0,Female,,Electrical Engineering,4,0,,,
725,4,1560,3,East Asian,"scioly, volunteering, badminton, FBLA, stem summer classes, coding club fo dounder, chinese club, chinese honor society, national cybersecurity comp award, regional scioly awards",0,1,3,0,1,0,0,Female,,Bioengineering,4,1,,,
726,4,1520,4,Asian,"research internship at washU, violin, hs tennis, club founder, school orchestra, volunteer org pres, club tennis regional winner, volunteer opportunity tutor, NHS, VP of math club, 2nd place at state algebra 2 & 1 math comp",0,1,4,1,1,0,0,Male,Washington,Biochemistry/Engineering,5,1,,,
727,3.83,,3,Black,"multicultural club, link crew mentor, local youth chorus, local musical theatre, professional musical theatre, school ambassador, GSA, student gov, election clerk, event photographer, yearbook, college board ambassador",2,0,0,0,1,0,0,Female,California,Political Science,3,0,,,
728,4,1400,4,Southeast Asian (Thai/Filipina),"figure skating, class VP, its academic team cap, JHU intern, SCLC conference leader, soundboard operator, service trip coordinator, ski club, spanish english & math tutor, ASPCA club, JHU book wards, NHS",3,1,3,1,1,0,0,Female,Maryland,Psychology/Public Health,4,1,,,
729,4,1570,3,South Asian,"NHS, french club VP, green team, taking care of elementary students after school, animal care",2,1,0,0,0,0,0,Female,,Chemical Engineering,3,0,,,
730,3.97,1570,4,Korean,"org of various benefit concerst, piano trio competitions, volunteering, founder of chem club, VP of AI club, internship at biotech startup in san francisco, research at JHU, research at stanford lab, USNCO honors, math works m3 10% challenege final, GMTK game jam finalist, 4x AIME qualifier, 2x AMC 12 distinction",0,1,0,1,1,0,0,Male,California,Biomedical Engineering,5,1,,,
731,4,1520,3,East Asian,"ambulance corps volunteeer, nonprofit business manager, orchestras, lifeguard, shadowed a physician, foreign language club, music outreach club, student researcher, varsity swim, comp sci club, le grand concours bronze, national violin comp silver",2,1,2,0,1,0,0,Female,,Cognitive Science/Pre-Med,4,1,,,
732,,1440,3,Korean,"student gov, nursing assistant, church youth group leader, math peer tutor, NHS and spanish NHS, swim, reading volunteer, healthcare club, CNA certification",2,1,2,0,1,0,0,Female,Illinois,Public Health,4,0,,,
733,3.84,1550,4,Asian/Chinese,"employed student researcher at columbia, research intern at columbia, project director and engineer at mars NASA comp, founder of research org, pres of FIRST robotics comp, exec VP DECA, junior research at NY academy of sciences and 1st place, design engineer at singapore space challenge & moon society moon base comp with 3rd place, team leader at conrad challenge and placed as semifinalist, team leader at wharton investment comp, pianist, 1st place team at mars comp, DECA NY states 3rd place",2,0,0,1,1,0,0,Male,New York,Aerospace Engineering,5,1,,,
734,3.89,1230,3,Filipino/Portuguese/Spanish/German,"interschool council, student gov, student leadership, school site council, french club, rally club, head blood drive coordinator, link crew, MOCK trial, academic decathlon, academic tutor, math team, youth leader, grad committee, NHS, CSF, academic scholarship",0,1,0,0,1,0,0,Male,California,Biological Sciences,4,0,,,
735,3.96,1440,3,South Asian,"student researcher at uni, employment at doctor's office, cofounder of school medical club, pres of science NHS, exec pres for student gov assoc, superintendent advisory council, arabic teacher at sunday school, rubik's cube speedsolving team cap, bridge building club, scienceoly, varsity soccer, grand award winner at regional science fair, national finalist at bridge building comp, national scholarship",1,0,4,0,1,0,0,Male,,Biochemistry/Molecular Biology/Sociology,4,1,,,
736,3.9,1540,3,White,"music, volunteer teacher, research asst at URochester, neurology internship, principal horn for city's youth orchestra, wind quintet, part time job, volunteer at cancer center, school cancer org, literary magazine",2,1,0,1,0,0,0,Male,New York,Cognitive Science,4,0,,,
737,4,1600,3,Asian (Indian),"mental health support club, self directed research, religious outreach volunteer, piano, knots of love, crisis hotline volunteer, summer job, ACT tutor, quarantine book club, 3rd place in state photography comp",1,1,0,0,1,0,0,Female,Arizona,Biology/Biochemistry,4,1,,,
738,4,1520,3,Chinese,"soccer, swimming cap, piano, FBLA pres, NHS pres, math HS, YMCA counselor, JHU engineering innovation, JHU biomedical engineering innovation, soccer referee, academic team, 1st place in FBLA states ",1,0,4,0,1,0,0,Male,,Applied Biomedical Engineering/Computer Science,4,1,,,
739,3.2,1600,3,Hispanic/White,"independent research in physics and cosmology, assisted in local museums, self published historial fiction novel, built several dozen model ships, top 500 overwatch player, JV cross country, book club",0,1,4,0,0,0,0,Male,Michigan,Astrophysics/Physics/Physics & Astronomy,5,0,,,
740,4,1580,3,White,"creative writing with publications, scioly cap, founder and pres of activism club, part time job, color guard in marching band, sunday school teacher, peer writing coach, library volunteer, german club member, literary magazine staff, scholastic gold medal for poetry, coke scholars semifinalist, national writing award, regional writing award",2,1,0,0,1,0,0,Female,,Biochemistry/Molecular Biology,5,1,,,
741,4,1500,3,White,"scioly cap, concert band, stock market investment, internship, honor council rep, JV golf, independent mandarin study, introductory microecon course from northwestern",0,0,4,1,1,0,0,Male,Texas,Economics,4,0,,,
742,4,1560,4,South Asian,"student research at washU st louis, summer 2019 researcher at oxford, global entrepreneurship firm founder and CEO, corporate analytics intern, MUN undersecretary general, taekwondo coach, investment and economics club founder and pres, 2018 independent paid summer research at UPenn, TED local science conference, education access nonprofit regional coordinator, ISEF finalist, best oral presenter award at international conference, 2020 RIKEN centre for brain science summer program presetner, 2020 AAN neuroscience research prize winner, missouri JSHS finalist and regional science fair winner, TKD gold at MO state and IL state, MO SIFMA stock market game winner",2,0,4,1,1,0,0,Male,Missouri,Symbolic Systems,5,1,,,
743,3.85,1500,3,White,"government cybersecurity internship, pres of large comm service club, varsity fencing, girls who code, volunteer at lab, peer helping club, cashier, volunteer at library, member of other clubs, NHS",2,1,4,1,1,0,0,Female,,Computer Science,4,0,,,
744,3.96,1560,4,African American/Other Race Minority,"founder of global youth publication, social media coordinator for nonprofit, youth volunteer chair, rep on advisory council, published author and researcher, research asst at t30, US rep and communications intern, youth advisory council member, art instructor, commendation in international psychology essay comp, NYT contest awards, scholastic silver key in art, california arts scholar",2,1,0,0,1,0,0,Female,California,Psychology/Sociology/Medical Anthropology,5,1,,,
745,4,1540,4,White (UK)/Asian (Filipino),"MUN pres, politics club pres, editor in chief of school paper, student council, volunteer math tutor, speech and debate, russian school of math student, math challenge club, peer minister, NHS, rensselaer medal award",1,1,0,0,1,0,0,Male,,Chemical Engineering,4,1,,,
746,4,1550,3,White/Persian-Jewish,"solo piano performer, ASB school pres, founder and pres of school jewish club, middle school science bowl coach, hs science bowl  ap, standwithus intern, school lead tutor, standwithus liaison, american red cross, eve and gene black summer medical program",4,1,0,1,1,0,0,Male,California,Biotechnology/Biomedical Engineering,4,0,,,
747,4,1560,4,White,"club, varsity & club swimming, MIT summer program, volunteer first responder, chem research intern, math tutor, social justice club, camp woker, biotech internship, state math contest finalist, NYT Op Ed award",2,1,4,1,0,0,0,Male,,Applied Mathematics/Pure Mathematics/Chemical Engineering,4,1,,,
748,3.5,1180,3,White,"theatre stage manager, thespian honors society VP",4,0,0,0,1,0,0,Female,,Public Health,3,0,,,
749,3.8,1460,3,Half-Japanese/Half-Caucasian,"founder and pres of ACLU club, dungeon master, cosplay hobby, drama, tutoring, SAGA, MUN",1,0,0,0,1,0,0,Female/Non-Binary,Oregon,Political Science,4,0,,,
750,4,1530,3,White,"asst manager at parent's store, volunteer & intern at local clinic, pres of science club, ultimate frisbee, PR officer for SGA, VP of NHS, pres of AVID tutoring program, pres and founder of debate club",4,1,2,1,1,0,0,Male,,Math/Chemical Engineering,3,0,,,
751,4,1590,3,White,"dual enrollment, STEM outreach club, scioly top 10 in nationals and pres, research at uni, neuroscience independent research, figure skating cap, national STEM program, volunteering efforts in central america, neuroscience award, figure skating regional winner",0,1,4,0,1,0,0,Female,,Engineering,4,1,,,
752,3.95,1570,3,Asian,"student gov, volunteering, varsity bowling, cgrocery store job, chinese school",1,1,4,0,0,0,0,Female,Michigan,Engineering,3,0,,,
753,4,1590,3,Asian (Chinese),"pres of NEHS, primary founder of philosophy club, english immersion tutoring, writing, recreational research, lepidopterology, constructing languages, art making, various volunteerings, member of chem club, NMS finalist, regional award for outstanding fine arts and academics, regional award for best show in art",2,1,0,0,1,0,0,Female,,History of Art and Architecture/Philosophy/Linguistics,4,1,,,
754,4,1550,4,Chinese,"research at georgia tech, FBLA VP, comp sci pres, research at UCLA, summer engineering internship, caltech summer program, published research, mathnasium instructor, congressional app challenge winner, national cyber scholarship finalist, american comp sci league",1,0,0,1,1,0,0,Female,California,Computer Science,5,1,,,
755,3.98,1540,3,White,"academic teams, cap of comp sci team, appalachian service project, boy scout, cross county, small business founder, student leader in religious retreat, individually in various state level academic comps placements",2,1,4,0,1,0,0,Male,,Electrical Engineering,4,0,,,
756,4,1500,3,White,"state senate campaign internship, yearbook member, speech adn debate pres, concert band, scholastic achievement award, NHS, student gov, political group, mental health policy work",0,1,0,1,1,0,0,Non-Binary,Oregon,Political Science/Environmental Studies,4,0,,,
757,3.76,1600,4,White,"intern at tech startup, engineering comp cap, debate cap, model congress pres, service org VP, summer math & tech program, top 10 national finish in team based engineering comp, debate champ, brown book award",0,1,0,1,1,0,0,Female,,Computer Science/Linguistics,5,1,,,
758,3.93,1490,3,White,"national student run org, mentor, business startup, app developer, patent, international film festival qualification, local & state sci fair participant",2,0,0,0,1,0,0,Male,California,Computer Science,4,1,,,
759,3.91,1430,3,Asian/White,"NHS, science NHS, tech student assoc, math team, 1st place at local tech fair, 1st place in state tech fair, 1st place in state math comp",0,0,0,0,1,0,0,Male,Georgia,Computer Science,3,1,,,
760,4,1540,3,Asian (Southeast),"city student gov pres, asian culture club VP, varsity diving cap and 2nd in state, superintendent council, speech and debate cocap, student gov, online english tutor, work, violin, auditing intern, VNSLI-Y korean scholarship, state magazine recognition, NHS",2,0,4,1,1,0,0,Male,Virginia,Linguistics,4,1,,,
761,4,1540,4,Asian,"congressional intern, board member of political advocacy org, speech and debate pres, created an initiative that teaches kids public speaking, student council officer, political magazine editor, independent history project, poli sci research asst, volunteer tutor, lead intern, national debate award, girls state governor, NHS",1,1,0,1,1,0,0,Female,,PPE/Political Science/International Relations/Economics/East Asian Studies,5,1,,,
762,4,1470,3,White,"tutoring at elementary school, intern at political office, student council, student ambassador, summer camp in china, chinese competitions, pet sitting, knitting club, NHS pres, math award",2,0,0,1,1,0,0,Female,California,Economics,4,0,,,
763,3.97,1400,3,Haitian-American,"haitian donation initiative founder, public health internship, public health club, tutoring nonprofit VP, health education nonprofit, political journal writer, teen court program volunteer attorney, country COVID response board, international thespians society VP, florida education board student rep, work experience, congressional health advocate, NSLI-Y arabic scholar, business pitch contest winner, questbridge national match finalist",4,1,0,1,1,0,0,Male,Florida,Linguistics/Ethnic Studies/Statistics,5,1,,,
764,3.75,1460,3,Asian/Indian,"exec board member copres YMCA volunteer club, varsity debate cap, board director of NPO targeting sexual violence, 800+ volunteer hours, NCFL LD national qualifier, NSDA nations, NSDA academic all american, second alterante qualifier in LD Debate",0,1,0,0,1,0,0,Male,North Carolina,Political Science/Public Policy,5,1,,,
765,3.6,1500,3,Caucasian (Middle Eastern),"writing, intern at finance division of mall, swim team, founder of investment club, dropshipping business, cofounder of social enterprise academy, delegate MUN, invested in crypto, volunteer, writing competition, boxing tournament win, MUN award",2,1,4,1,1,0,0,Male,International,Economics,4,1,,,
766,3.9,1510,3,Multiracial (Caucasian and Chinese),"3d printing club founder and pres, activism org, varsity ice hockey cap, local nonprofit, school ambassadors, student gov VP, odyssey of the mind, peer mediation pres, scioly, intern for congressman, OOTM world finalist, hockey awards",0,1,4,1,1,0,0,Male,,Art/Business Economics/Mechanical Engineering,5,1,,,
767,3.96,,3,Black American,"marching band section leader, concert band, student rep, community service, tutoring kids, crotchet business, social media management, NHS",1,1,0,0,1,0,0,Female,New York,Communications,3,0,,,
768,3.9,1510,4,White,"IT director of writing center, mentorship at google, comp sci department editor, tutor at comp sci tutoring center, logistics organiser at school hack-a-thon 1st chair trombonist in school orchestra, intern at local political campaign, python teacher at STEM nonprofit, intern at local library, long distance cycling, music comp hobby, 2nd place at school hackathon, USACO silver",2,0,4,1,1,0,0,Male,New York,Computer Science,5,1,,,
769,3.7,1510,3,Chinese,"marketing director & instrucotr of guitar club, coleader of org that sold advocacy pins, guitar, summer camp counselor, youtube with 140k views, volunteered as TA, member of dance club, digital marketing coursera courses, volunteered at coding tutor, key club",2,1,2,0,1,0,0,Male,,Statistics,4,0,,,
770,3.93,1570,3,Indian,"2x all state athlete, 3x scholar athlete, varsity cap, nonprofit, rating agency internship, international startup incubator, edtech startup company, bank internship, academic decathlon pres and 2x national qualifier, we the people team, 3rd place in international startup incubator",2,1,4,1,1,0,0,Male,,Economics,5,1,,,
771,4,1500,4,Black/African American,"MIT MOSTEC, research intern for MIT, developer for personal coding projects, VP of comm service and FBLA, dual enrollment mentoring org exec board member, absentee ballot clerk, georgia girls state citizen, VP of beta club, member of NHS, sunday school secreatry, best of MIT semester science writing award, placed 8th in FBLA business ethics comp, governor's honor program in engineering",2,0,0,1,1,0,0,Female,Georgia,Biomedical Engineering,5,1,,,
772,3.85,1380,3,Cuban American,"selected for STEP UP for NIH, founder and pres of mental health awareness club, bioscience research internship, LLS students of the year, varsity cross country & track, pres of bio scioly, discussion leader at neuroscience research journal club, personal book selling business, NCSSM neuroscience summer camp, regional service ambassador, scioly bronze 2x, NHS VP",2,0,0,1,1,0,0,Female,North Carolina,Neuroscience,5,1,,,
773,3.89,1200,3,White,"drama club pres, improv club, NHS, student council, blankets of hope, social justice, job, thespian society, link crew, DEI commitee",1,1,0,0,1,0,0,Female,Illinois,Film and Television,4,0,,,
774,3.94,1600,4,Chinese,"poketwo creator and dev, UCSB research program, contestdojo dev, mobile app for hs founder, project code foundation founder, nanomath founding member, FBLA, scioly, anime club VP, boy scouts of america, USAPho semifinalist, USACO platinum, 3x AIME qualifier",4,0,0,0,1,0,0,Male,California,Computer Science,5,1,,,
775,3.83,1600,3,White,"research internship with professor, music composer and player, charity head of PR, varsity football, varsity baseball, tutor, 3rd place in state wide research symposium, first place in state science fair, nominated for ISEF",2,1,2,1,1,0,0,Male,,Physics,5,1,,,
776,3.94,1530,3,White,"student council pres, illinois youth and gov founder and pres, school senate pres, MUN pres, history club co pres, pep club, NHS, math team, science and engineering team, 1st place regional comp sci award, 2nd place regional engineering award, 1st place in team regional math comp",0,0,0,0,1,0,0,Male,Illinois,Political Science/Government,5,1,,,
777,3.92,1560,4,Asian American (Chinese),"contract bridge nationally placed, sci oly co pres and state qualifier, math league co cap, FBLA placed nationally, research at local college, summer program, studio asst at local music studio, student gov, charity board, volunteer trip, AIME qualifier, math prize for girls qualifier",2,1,0,0,1,0,0,Female,,Chemistry,4,1,,,
778,3.62,1510,3,White,"young republicans pres, varsity baseball cap, green society",0,0,4,0,1,0,0,Male,,Economics,4,0,,,
779,3.84,1510,4,Asian,"paid software engineering intern at fortune 500, sport captain, comp sci honor society VP, robotics club team leade, lead teacher at robotics summer camp, astronomy club VP",2,0,0,1,1,0,0,Male,,Computer Science,5,1,,,
780,3.96,1370,4,Black/African-American/Cameroonian-American,"published a three part book, co founder of creative writing club, co founder of literary magazine for school, summer creative writing group for teens at library founder, writing classes, teen volunteer at local library, promoter & board member of VOICES, promoter and co speaker of SAGA, play violin duets, concert orchestra, recognised by Merriam Webster, 2x gold key winner, yale young global scholars, bennignton young writers awards finalist, 3rd place in local write on contest",4,1,0,0,1,0,0,Female,Minnesota,English/Political Science,5,1,,,
781,4,1580,3,White,"MUN leader, math team, church group volunteer, church janitor, abbvie pharma worker, goemetry tutor, track & field, foreign MUN program, pre calc course, outstanding delegate, hm in uchicago MUN, 1st place in regional math comp",3,1,1,0,1,0,0,Male,Illinois,Math/English/Behavioural Economics,4,1,,,
782,4,1600,4,Chinese American,"wrote a book on AI, published researcher, founder of virtual volunteer orgs, co founder of robotics team, intern, editor in chief of school journalism club, volunteer, presenter in radio",2,1,0,1,1,0,0,Female,,Computer Science,5,0,,,
783,4,1520,3,Hispanic,"yearbook editor, JCL, volunteer at animal shelter and as tutor, owner of business",2,1,0,0,1,0,0,Female,Texas,Economics/Mathematics,3,0,,,
784,3.84,,4,Asian,"clothing business, pres of student council, pres of NHS, policy advisor for city, cofounder of school's student led group, interned for city council, youth community org, youth equity team, school tutor, library asst, NHD state finalist, questbridge college prep scholar & national match finalist",2,0,0,1,1,0,0,Female,Minnesota,Political Science,4,1,,,
785,4,1550,4,Asian,"intern & researcher in team with two t5's, independent researcher, founder spacecraft team, ambassador about rocketry, intern on hepC, web designer, pres of clubs, copres of ap chemistry tutoring club, hackathon participant with 2nd place, regeneron ISEF first place, MIT think scholar semifinalist, NASA space settlement contest first place",0,1,0,1,1,0,0,Male,,Physics,5,1,,,
786,3.96,1530,3,Caucasian,"volunteer swim teacher, managing free health screening at church, lifeguard, sculptor, exhibition as sculptor at 3 local shows, summer research at t20, cap of water polo & swim team, cap of sci oly, leader of exploravision club, scholastic art & writing state gold key",1,1,4,0,1,0,0,Male,Illinois,Biology,4,1,,,
787,3.88,1540,3,South Asian (Indian),"illusion research, co founded a study website, STEM teams, tutor, outreach educator, school ambassador, student gov, mu alpha theta VP, zoo volunteer, environmental scienc eresearch, 11x scioly regional medals, 3rd place at state science fair",0,1,0,0,1,0,0,Female,Alabama,Cognitive Science,4,1,,,
788,3.96,1340,3,White,"boy scout, student orgs, founded two clubs, comm service, jobs",3,1,0,0,1,0,0,Male,,Statistics/Mathematics,3,0,,,
789,3.75,1580,3,Chinese,"pres and founder of nonprofit, internship, research in econ, participation in UPenn wharton program, copres of student club, projects leader of science NHS, USABO semifinalist, NJS bio2 third place, NSE gold award, FBLA regionals 1st place, PVSA Gold",0,1,0,1,1,0,0,Male,New Jersey,Economics/Business/Finance,5,1,,,
790,4,1530,3,Asian,"founder of schools sustainability club, cofounder of school's MSA, environmental science research at local uni, volunteer for local refugee agency, MUN, track & field, high school women in STEM scholarship, local environmental art contest finalist",0,1,2,0,1,0,0,Female,,Biochemistry,4,1,,,
791,3.8,1500,3,Black,"summer engineering program at local uni, volunteered at family clinic, VP of student gov, kakehashi juice, self taught arabic, global discussion club co founder, jazz and concert choir, blog to advertise, schulich scholar",0,1,0,0,1,0,0,Female,International,Education/Ethnic Studies,4,1,,,
792,3.9,1250,3,White,"track and field, link crew",0,0,4,0,0,0,0,Male,,Political Science,3,0,,,
793,4,1540,3,Asian,"internships, club leadership, work, DECA internationals semifinalist, state piano comp 2nd, PVSA gold",2,0,0,1,1,0,0,Female,,Health Policy,4,1,,,
794,3.99,1540,4,Middle Eastern,"game designer, community manager at gaming startup, education USA competitive college club, international math modeling challenge highly ranked, olympiads in informatics, cryptology summer camp, internship at web design company, third place in american math comp, certificate of high achievement, comp sci 50x puzzle day, MUN, math tutoring, social solidarity club, turkish translation, poetry writing, archery, soccer & basketball, education USA opportunity funds award",2,1,2,1,1,0,0,Male,International,Computer Science/Applied Mathematics,5,1,,,
795,3.88,1450,3,Southeast Asian,"head of academic department at psych club, head of logistics department at hotline, tutor and event organizer, member of club that provides food for impoverished people, cooking and taking care of siblings, cooking at a local hospital for hold people, badminton club, VP of class, tour guide of disabled children in hanoi, waiter at grandma's restaurant, participant in internatinoal advanced english course at KCL, gold medal at indonesia international applied scioly, gold prize at ICPC of korea uni invention assoc, 2nd place in Hanoi foreign film review contest",4,1,2,0,1,0,0,Male,International,Psychology,4,1,,,
796,3.9,1570,3,White,"musical theater, cross country, student council VP, student newspaper editor in chief, sustainability committee, MUN, french club VP, global scholars research, NHS VP, violin, integrity award, regional theater award, international thespian society",0,0,4,0,1,0,0,Male,Florida,Theater/Physics,4,1,,,
797,3.95,1600,3,Hispanic/Latinx,"family auto business asst manager, debate 6x finalist, mock trial, spanish NHS, political club, social studies NHS, retail job, science league, family responsibilities, top 10 highschool team in state for science, 1st place debate state tournament",4,0,0,0,1,0,0,Male,,Political Science,4,1,,,
798,4,,4,Asian/Pacific Islander,"nonprofit VP pres, pres of school leadership, exec of another school leadership group, paid summer internship, selective summer program overseas, varsity niche sport, varsity speech & debate, published research paper, pres of another school leadership group, national writing comp finalist, hm in regional writing comp, art comp awards",0,0,4,1,1,0,0,Female,California,English,5,1,,,
