ID,GPA_unweighted,SAT_total,Income_level,Ethnicity,ExtraCurriculars,Job_years,CS ,Sports_years,Internship_flag,Leadership_flag,First_gen,Legacy,Gender,State,Major,EC_score,Award_flag,Column 1,Column 2,Column 3
332,3.96,1500,,Asian (China),"national gold/silver medals in scholastic awards, co founded a business, co founded a fulfilled by amazon business, helped create a mentorship program, varsity tennis, founded a summer tennis camp, part of FTC team, advisor of school's startup club, violin, scholastic art and writing national best in grade and gold medal for illustration",2,1,4,1,1,0,0,Female,,Manufacturing and Design Engineering,,1,,,
333,4,1540,,Filipino,"marching band, volunteer work through band, piano, red cross for 3 years, UNICEF member for 1 year, catholic confirmation course, creative writing hobby (AO3), chamber ensembles",0,1,0,0,1,0,0,Female,California,Biology/Pharmacy,,0,,,
334,3.64,,,African,"student gov association, caregiver, tutoring club, mentoring org, food warehouse volunteer, caretaking facility job, policy and congressional debate, intercollegiate research journal, ASL club tutor",2,1,0,1,1,0,0,Female,,Biology/Biochemistry,,1,,,
335,4,1540,,White,"pres of young democrats, pres and founder of Model UN, cocap of speech, intern on 7cups, intern at local federal court, campaign asst for state rep, legislative page to state house, marching band, worked at chick-fil-a as a summer job, bernie volunteer, poetry published in some state publicatoin",2,1,0,1,1,0,0,Female,Vermont,Political Science,,0,,,
336,2.7,1180,,Hispanic/Black,"graphic design intern at nyc college, waitress/chef at wing shop, on LaX team, tour guide, participated in program offered that taught about lighting tech, school news anchor, caregiver to little sister, sadie nash sisterhood",2,0,0,1,0,0,0,Female,New York,Computer Science,,0,,,
337,3.8,1580,,Indian,"michigan math prize comp, canadian math olympiad invitee, AIME invitee, engineering VP and asst programming lead of FRC team, student researcher at local uni, independent research, captain of various math comps, mentor of 3 middle school robotics team, hobby programming and 3d printing, pres of comp math club, math tutor for underprivilidged students, piano, member of school math and physics club",2,1,0,0,1,0,0,Male,Michigan,Computer Engineering,,1,,,
338,3.93,1560,,Asian,"speech & debate team cap, model UN, young leaders in healthcare VP, superintendent advisory council, district health and welness comittee, international public policy forum, NHS, cal scholarship federation, writer at media startup, sunday school teacher, paid tutor, hospital volunteer",2,1,0,0,1,0,0,Male,California,Economics,,0,,,
339,4,1540,,White/Hispanic,"FTC Robotics, Cross country, quiz bowl pres, political activism founder, peer tutoring, writing center, yale book award",1,0,4,0,1,0,0,Male,,Economics,,1,,,
340,3.76,1600,,,"cross country, consulting at fortune 500 firm, music composition, service trip funding, AMC-10 winner, NMSQ finalist",2,1,3,0,0,0,0,Male,,Computer Science,,1,,,
341,4,1500,,White/Ashkenazi/Jewish,"student congress, student rep of board of education, model UN, youth advisory council, remote intern at political consulting firm, restaurant work, school musicals, activism student org, campaign intern, varsity field hockey,  public speaking contest winner",2,1,4,1,1,0,0,Female,New York,Political Science/Environmental Science/International Development/Urban Studies,,1,,,
342,3.9,1400,,Asian,"speech and debate copres, varsity track and field, NHS, activism, work, student gov, model UN, robotics, internship, speech and debate tournament winner, 2nd place in engineering cs project with state uni",2,1,2,1,1,0,0,Female,Arizona,,,1,,,
343,3.96,1550,,East Asian,"math team pres, mentoring program co founder, research intern at state uni, school newspaper staff, volunteer at senior center, working part time at family restaurant business, data analyst intern, school symphony orchestra, taught violin /viola lessons, econ challenge team, state science & engineering fair HM, 3x AIME qualifier",4,1,0,1,1,0,0,Female,,Applied Mathematics/Economics,,1,,,
344,4,1530,4,Asian,"intern at father's company, asst at uncle's clinic, finance club leader, TSA team, FBLA",2,0,0,1,0,0,0,Male,,Business,,0,,,
345,4,1460,,White,"founder of STEM club, pres of DECA, key club, paid chem internship, wildlife refugee hospital volunteer, docent at historical museum, choir and school musical participant, varsity cheer, neuroscience research, volunteer at academy of natural sciences, world language honor society member, NHS, neuroscience journal contributor, DECA awards, 1st in south jersey for marketing comms",0,1,4,1,1,0,0,Female,New Jersey,Environmental Science,,1,,,
346,3.83,1490,,White,"head of social justice comittee, ESG empowerment quant model developer, head of investment club, published research on gender, cofounder of girls who invest, community service at women's shelter, summer job, eastern ski racer, school newspaper, math club, LGBT",2,1,4,0,1,0,0,Male,,Business/Gender Studies,,0,,,
347,4,1410,,African American,"science honor society VP, upperclassmen org, founder of free tutoring service, HOSA club, ACTSO award, GBB award, Joe Berg Scholar, vet clinic volunteer, chem lab aid, cofounder and writer on school newspaper, food job, joe berg seminar students",2,1,0,0,1,0,0,Female,Florida,Nursing/Public Health,,1,,,
348,3.83,1500,,Asian,"cybersec comp, comp sci mentorship at UC, bioinformatics research program at another UC; independent NLP research, paid tutor in math, quizbowl, ted talk organizer, CTF comps, leadership in nonprofit, piano performing, 4x national semifinalist, cybersec $2500 scholarship",3,1,0,0,1,0,0,Male,California,Computer Science/Computer Science + Linguistics/Design Science,,1,,,
349,3.76,,,White,"worked as IT admin for 4 years, cofounder of online business, cofounder of airsoft community, founder of coding club, 4 years of volunteering, U18 volleyball team, MOOCs MIT, robotics team VEX, grade pres, MIT hack4inclusion, MIT tech blueprint",4,1,4,0,1,0,0,Male,International,Computer Science/Electrical Engineering,,1,,,
350,3.97,1540,,White,"cap of club soccer, asst editor in chief of yearbook, vp of comp sci honor society, member of hospital teen board, student ambassador, camp counselor",1,1,4,0,1,0,0,Female,,Electrical Engineering,,0,,,
351,4,1600,,Asian,"FBLA club, MUN pres, nonprofit for tutoring, econ research at USC, leadership in business summer program, MIT launchx summer, varsity tennis, math club, coding club, local and state level FBLA awards, USACO gold, AIME qualifier",0,1,4,0,1,0,0,Male,California,Computer Science,,1,,,
352,4,1590,,Hispanic,"math club, comp sci copres, math comp group, MIT summer program, science NHS, tutoring, LOL member, community service, french practice, video game, top 10 in large comp sci competition, AIME qualifier, USACO gold",2,1,0,0,1,0,0,Male,,Applied Mathematics,,1,,,
353,3.93,1590,1,East Asian,"part time job, family responsibilities, attended SUMAC ROSS and PROMYS, cofounded nonprofit, presented a self directed resaerch project, pres of STEM and mathclub, community service project, OTIS, USAMO winner, canada math olympiad, canada APMO",4,1,0,0,1,0,0,Male,International,Math,5,1,,,
354,3.92,1560,,Mexican,"MOSTEC, science olympiad for state qualifying team, biology research, board member at local uni, board member at educational nonprofit, class pres, positive news podcast, hospitval volunteering, best of MOSTEC award, speech and debate 2x qualifier, biomedical research award",2,1,0,0,1,0,0,Female,Immigrant,Molecular and Cellular Biology,,1,,,
355,4,1580,,Asian/White,"self taught mandarin, software engineer intern at fortune 500, cofoudned a major chiense learner literature and lang website, open source coding projects, head developer of school student magazine, founder and co leader of school math club, paid content writer for chinese easy readers, authored a fantasy series, blogging, 1:1 tutoring, full merit scholarship",2,0,0,1,1,0,0,Male,California,Computer Science,5,1,,,
356,3.65,1580,4,White/Asian,"classical piano, physics research, first chair clarinet, summer college credit math course at Stanford, music performance volunteering, figure skating, grad level summer math class with research paper, reading tutoring at comunity center, college math program at umich, mask sewing, piano awards, AIME qualifier",0,1,4,0,1,0,0,Male,Michigan,Math,5,1,,,
357,4,,1,White,"music production, fast food worker, marching band, percussion ensemble, county honor band, church volunteering, art",2,1,0,0,0,0,0,Non Binary/Demigender,California,Music Industry,3,0,,,
358,3.65,1500,2,White,"swim team cap, leadership positions at local nonprofits, piano, model UN, commmunity service, politics based activities, lifeguard",0,1,4,0,1,0,0,Male,,Political Science/Economics,4,0,,,
359,3.76,1290,3,Indian/White,"PVSA gold, AATG gold, HOSA 5th place, sciolympiad 2nd place, climate change activist, editor of student journal, shadowed interns at NASA, verified listener with 7cups of tea, marketing & data analytics for nonprofit, volunteer tutor, self taught freelance digi artist, self taught video editor, VP of beta club, swim instructor",2,1,0,1,1,0,0,Female,Georgia,Psychology,5,1,,,
360,4,1500,1,White,"Questbridge national finalist, girls state, math and science scholar, FBLA school pres",0,0,0,0,1,0,0,Female,Florida,Earth and Planetary Sciences/Biochemistry,5,1,,,
361,4,1480,3,White (Middle Eastern),"all league member of hs soccer, player of highly competitive club soccer, played hs soccer, worked as caretaker for neighbour, licensed referee, TA for engineering teacher, research asst at program with UMelbourne, worked on a project with stanford, worked with NGO",2,1,4,0,1,0,0,Male,California,Engineering,4,0,,,
362,3.75,1510,2,White,"3x all league selection in varsity sport, club sport team cap at national level, youth group leader, cs 200+ hours, summer program at college, coursera marketing class, woman's org participant, diversity club, personal investment",0,1,4,0,1,0,0,Female,Florida,Business/Marketing,4,1,,,
363,3.83,1500,3,White,"science award, environmental research at UC, science events at school, environmental science website, science fair, environmental science club pres, engineering related activites, NHS science, NHS, feminist club, physics club",0,0,0,1,1,0,0,Female,California,Environmental,4,,,,
364,3.91,1500,3,,"silver medalist at world mathematics invitational, cap of debate club, cap math club, pres of student council, art showcase for orphans, bronze at world math team championship",0,1,0,0,1,0,0,Male,,Math,5,1,,,
365,3.6,1430,,Asian/White,"student film festival award, film club pres, JV basketball and rugby, tutoring math and EAL",0,0,3,0,1,0,0,Female,California,Film Studies,3,1,,,
366,3.74,1480,3,South East Asian,"international AI hackathon award, skills USA national qualifier, NSLI-Y recipient, personal AI projects, online business, international web design lead at nonprofit, machine learning engineering intern, pres of coding & engineering club, state comp sci education board nonprofit, started a mental health insta account, bass section leader in choir, voice teacher, healthcare intern at chiropractic office, varsity wrestler",3,1,4,1,1,0,0,Male,California,Computer Science,5,1,,,
367,4,1560,1,White,"track and field, cross country, diving, volleyball, student to student, political campaign, cofounder of democratic club, NHS, leader on work trip, buddy at camp for adults and teens with disabilities, lifeguard, concessions, guest services, dive coach, swim instructor, target worker, vet office worker, usher, nanny",4,1,4,0,1,0,0,Female,,Chemical Engineering/Chemistry,3,0,,,
368,3.41,1500,2,White,"best defense attorney award, mock trial team founder and cap, varsity track cap, girls scouts, volunteer sleep away camp counselor, writer for school newspaper, paid camp counselor, volunteer tutor, leader of school spirit org, ACLU club leader, brownu pre college",2,1,4,0,1,0,0,Female,Vermont,Political Science/French/Pre-Law,4,1,,,
369,4,1540,,Asian,"quiz bowl, science olympiad, math team, badminton, freshman mentor",0,0,2,0,1,0,0,Male,,Biomedical Engineering,3,0,,,
370,4,1510,3,Hispanic,"wellesley book award, top 19% paper in math modelling challenge, worship leader & screenwriter, secretary of math team & mu alpha theta, VP of paws with cause, VP of sales freshman year, stock portfolio internship, writing fellows, lead in musical, chem tutoring, NHS membership, scientific research education internship",2,1,0,1,1,0,0,Female,Florida,Biology,4,1,,,
371,4,1550,2,South Asian,"cross country & track, teaching coding to middle schoolers, VP of senior citizen letter writing, science fair, independent research, ML image classifier, interned and job shadowed with professor of pharmaceutical sciences, DECA member, war memorial cleanup crew member, key club, NHS",2,1,4,1,1,0,0,Female,,Biomedical Engineering,4,0,,,
372,3.99,1400,2,White,"varsity basketball, baseball & football, NHS, student ambassadors club, founder of lawn care business, soccer referee and baseball umpire, catholic athletes for christ",4,0,4,0,1,0,0,Male,,Finance,3,0,,,
373,3.98,1560,3,Asian,"ISEF finalist, southeast michigan science fair second place, michigan science fair second place, KSEA michigan chapter 1st place, top MMPC, NHS, mathcounts head coach, mathnasium volunteer, math volunteering club, fundraising head, JV tennis, orchestra, internship at seoul national u, internshiph at michigan ion beam lab, awesome math participant",2,1,2,1,1,0,0,Male,Michigan,Engineering,5,1,,,
374,4,1490,,White,"boys varsity hs swim team cap, girls varsity hs swim team manager, special olympic swim team unified partner, piano, speech & debate",2,0,4,0,1,0,0,Male,,Business/Finance,3,0,,,
375,2.7,1170,1,Asian,"excellence in theatre award, theatre in hs, theatre consultant, employed at home depot, employed at community college, employed for annual local show",4,0,0,0,1,0,0,Male,Michigan,History/Air Force ROTC,3,1,,,
376,3.9,1530,4,White,"regional photography award, avalnche science mentee, intern at local environmental conservation org, skiing, freelance photo, socer, XC and trail running, professional photography, NHS VP, landscaping, soccer camp volunteer coach",2,1,4,1,1,0,0,Male,,Environmental Science,4,1,,,
377,3.83,1530,4,Chinese,"ARML qualification, AIME qualification, 3rd place at pan asian abacus and mental arithmetic comp, published articles, city math team, school math team, math team mentor, TA at abacus academy, red cross, school newspaper editing department, social media, tutor for nonprofit, other activities",2,1,0,0,1,0,0,Female,,Mathematical Economics/Math and Economics,4,1,,,
378,3.7,1460,3,South Asian,"head of electronics on FRC robotics, student at cs related MIT program, summer research at NYU, TA at NYCDOE test prep program, member of robotics club, mentorship program",2,0,0,0,1,0,0,Male,New York,Computer Engineering,5,0,,,
379,4,1570,4,Hispanic/Jewish,"first place in regional chemp comp, perfect scores in national latin exam, varsity golf, national society of medicine VP, volunteer work with NJ tree foundation, medical program at UPenn, DECA, FBLA, science league team, job at father's comp, founding officer at nonprofit chapter, pediatric medicine course",1,1,4,0,1,0,0,Male,New Jersey,Biology,4,1,,,
380,3.9,1580,2,Hispanic/White,"NSDA academic all american, JSA best speaker, editor in chief school newspaper, public forum debate, JSA chapter leader, campus ministry rep, writing ceter tutor, job at ice cream shop, ultimate frisbee team cap, member of latin american students assoc, cross country & track",2,0,4,0,1,0,0,Male,Washington,Environmental Policy,4,1,,,
381,3.44,1360,,Hispanic/White,"scholastic photography awards, NHS, baking blog in insta, singing, clothing business, babysitter, TA, taught english classes, self taught guitar, knowledge bowl member, podcast",2,0,0,0,1,0,0,Female,,Hotel School/Business,3,1,,,
382,3.95,1480,2,Asian/European,"reddit moderator, local city youth council member, cross country, track and field, squash, worked at IT school department, activist and organizer, school poetry comp",1,1,4,0,1,0,0,Male,Vermont,Computer Science/Political Science/Sociology,3,0,,,
383,4,1600,2,East Asian,"scholastic gold key, research at NYU, research at mt sinai, tutoring, NYPL, curriculum development, sibling care, family restaurant, DECA",4,0,0,1,1,0,0,Female,New York,Neuroscience,4,1,,,
384,3.6,1410,1,Asian,"secretary and pres of social activism club, chapter agent for large political org, NHS leadership, sunrise movement houston leader, math teacher volunteer, team ambassador, part of different hs communities, political internships, psychiatrist internship, two free programs at T20 school, 100+ cs hours",0,1,0,1,1,0,0,Female,Texas,Business/Finance/Public Policy/Economics,4,0,,,
385,3.71,1560,,White/Asian,"two school track records, 2nd place in speech contest, track and field cap, japanese fluency, addiction recovery org, internship at AIMS, fundraising, tutoring org, translator, DJing",2,1,4,1,1,0,0,Male,New York,,4,1,,,
386,4,1540,2,White,"FTC robotics, part time job, ethics bowl, AEOP research apprenticeship, football, volunteer position at library, part time job, junior rotary, science bowl team cap, community band",2,1,4,1,1,0,0,Female Turned Male,,Mechanical Engineering,4,0,,,
387,3.93,1440,2,Asian (Chinese),"hackaton awards, JROTC awards, participant of hackatons, class leader, black belt taekwondo, founder of an app, head organizer of 12 hour hackathon, head organizer of 48hr online hackathon, pres of comp sci club, captain of academic bowl team, varsity sport, founder of robotics club, 200+ cs hours",0,1,4,0,1,0,0,Male,New York,Computer Science,5,1,,,
388,3.98,1600,3,Asian,"cello varsity, soccer varsity, tutoring business, wall street club, research at SMU, soccer camp, community service 300 hours",2,1,3,1,0,0,0,Male,Texas,,4,0,,,
389,4,1560,2,Jewish,"AIME 3x qualifier, top placements for national speech and debate, FIRST robotics award, harvard book award, co founder and cap of debate team, class pres, student leader for recycling nonprofit, head of software for robotics, student rep, pres of mu alpha theta, track and field, waiting tables",3,1,4,0,1,0,0,Male,,Computer Science/Economics/Finance,5,1,,,
390,3.9,1480,1,Asian (Filipino),"intermediate art award, raising canes worker, nevada junior classical league convention copres. orchestra 2nd chair, green club composting officer, FRC buildier, FTC referee, track & tennis, NHS member, home cook",2,1,4,0,1,0,0,Male,Nevada,Mechanical Engineering/Physics,3,1,,,
391,3.96,1550,4,Asian,"international research award, science olympiad medals, mandarin essay writing award, independent research into computational biology, science olympiad, art, violin, math club, violin tutoring, internship, volunteering, foreign language, figure skating",2,1,2,1,0,0,0,Female,,Computer Science,4,1,,,
392,3.8,1540,3,Jewish,"cofounded a political org, worked on political campaigns, volunteered at science museum, debate, class pres, national lang award",2,1,0,0,1,0,0,Female,New York,Physics,4,1,,,
393,3.95,,2,Latino,"acapella choir director, freshman class pres, sophomore VP class, military voluntary service, pres of MUN, comm service member, admin department intern, taking care of household tasks, regional award best essay, international MUN of ministry of education finalist",0,1,0,1,1,0,0,Male,,International Relations,4,1,,,
394,4,1540,4,White/Asian,"debate club pres, TA comp sci course, political volunteering, inspiritAI program, AMC 10 and AMC 12, biking club pres, track and field co cap, outreach advocacy, math ta, stanford summer session, harvard summer school, prestigious engineering program",2,1,0,1,1,0,0,Male,California,Computer Science/Economics/Philosophy,5,0,,,
395,3.99,1500,1,White,"competitive marching band, NHS, educators rising, governors school, free summer program, class SGA, school VP, state secretary of edu scholar, carson scholar",0,1,0,0,1,0,0,Female,Pennsylvania,Neuroscience,4,1,,,
396,3.74,1330,1,Indian/White,"STEM community service, computer hardware club, robotics club, esports club, game development club, job experience",2,1,0,0,1,0,0,Male,,Computer Science Engineering,3,0,,,
397,3.88,1460,2,Asian (Filipino),"congressional intern, wildlife conservancy cleanup, VP ecological restoration club, track athelete, TEAL CARES cs award",0,1,4,1,1,0,0,Male,,Political Science,3,1,,,
398,4,1580,,White,"science NHS, german honor society, mu alpha theta, vex robotics team cap, technology student assoc, youth group VP, state bronze achievement award",0,0,0,0,1,0,0,Male,Georgia,Computer Engineering,3,1,,,
399,3.88,1370,2,Black/African American,"quantum physics research with T50 uni, member. of local youth org, google code next connect program, employed at retail store, student council rep, health club social media manager, participant in math program, college board african american award, presenter at uni's research conference",2,1,0,1,1,0,0,Female,,Computer Science,5,1,,,
400,4,1500,2,White,"founder and pres youth service club, cofounder of gaystraight alliance, school newspaper, church volunteer, farm work, caregiver for younger siblings, waitress, baking for community events",2,1,0,0,1,0,0,Female,,Public Policy/History,4,1,,,
401,4,1570,4,Asian,"math workbook author, summer science program strophysics researcher, science bowl pres, STEAM club pres, sunday school teacher, cs volunteer, math club competitor, online AMC 8 course instructor, creative writing contributor, mental health research, 4x AIME qualifier, PVSA gold",4,1,0,0,1,0,0,Male,California,Mechanical Engineering/Math,5,1,,,
402,3.45,1600,4,Jewish,"leadership position in school lang magazine, student ambassador and tour guide, part time job, tournament scrabble, professional photography, school radio host, volunteer with disabled children, private tutor, piano player, proficiency in five languages, youngarts award, scholastic art and writing silver key",4,1,0,0,1,0,0,Female,Oregon,Linguistics/Criminology/French,5,1,,,
403,3.4,1560,,White,"hs theatre, theatre student board, camp counselor at community theatre, math tutor, comp sci club, lead for a minecraft mod open source development team, feminist club, online discord tutor for math, jewish club, ASL community projects, thespian gold troupe",2,1,0,0,1,0,0,Male,California,Mathematics,4,1,,,
404,4,1550,4,East Asian,"dance co leader, varsity track, research at pioneer program, environmental club, founded service club, translated for khan academy, tutor, student gov, speech & debate, hobbies, national earth science olympiad silver, national hackathon 2nd pace, national math comp silver",4,0,3,0,1,0,0,Female,,Environmental Science/Chemical Engineering/Public Health,5,1,,,
405,3.91,,2,African American,"JV & varsity tennis, theatre lead roles, LINK crew, violin & piano, IDD awareness club, volunteer at church and local elementary school, attend academic academy after school, MVP award for tennis, CIF-SS d4 champ",0,1,4,0,1,0,0,Female,California,History/Law,4,1,,,
406,3.97,1530,1,Latino,"paid congressional internship, debate cap, local hs for biden chapter, public speaking coach, intern at economic developent firm, racial justice protest, local young democrafts chapter, guitar, volunteer for senate campaign, temporary office worker at insurance company, questbridge college prep scholer, high placement at state tournament for congression debate",2,1,0,1,1,0,0,Male,Texas,Political Science,5,1,,,
407,4,,2,Jewish,"4-H state winner comp team, staff writer, intern at advocacy org, alumni board, TA for ap gov, intern at advocacy org 2x, volunteer, curator, work at synagogue, duke TIP, winner of national essay contest",2,1,0,1,1,0,0,Female,North Carolina,Political Science,4,1,,,
408,4,1560,4,Asian,"research in pathophysiology, research in neuroscience, pres of USA biolympiad, volunteer tutor, varsity tennis manager, USABO semi top 125",0,1,0,0,1,0,0,Male,,Neuroscience/Business/Computer Science,5,1,,,
409,3.5,1300,2,Hispanic,"student gov VP, local community service, varsity track and tennis, mock trial, focus on the drive treasurer, research projects, COVID relief, key club, community service 300+ hrs, unsung hero award",2,1,4,0,1,0,0,Female,New Jersey,Computer Science,4,1,,,
410,4,1530,4,Jewish,"midwest debate club director, VP of french honor society, fundraiser head of activism club, participant in highest ranked symphony in country, tutored students, math team cap, TA, theater principal role for musical, speech varsity member, receptionist, model UN, leadership conference, speech awards",2,1,0,1,1,0,0,Non Binary,,Economics,4,1,,,
411,3.9,,,Black,"science olympaid VP, band, volunteering, office asst, st baldricks, band camp, book club, junior marshall, beta club",2,1,0,0,1,0,0,Female,North Carolina,Biomedical Engineering,3,0,,,
412,4,1510,4,Asian (Indian)/American,"science olympiad pres, self taught web developer, chess team, theatre stage crew, math team, sexuality and gender alliance, volunteer at local arts org, volunteer at ESL summer day, volunteer shadowing at hospital pharmacy, student at a free residential summer program T50, gold medals in science olympiad, gold medal at regionals chess tournament, US presidential scholars program candidate",0,1,0,1,1,0,0,Agender,Pennsylvania,Molecular Biology,5,1,,,
